{
  "version": "2.0",
  "producer": {
    "name": "skom/stylex-connector",
    "version": "2.0"
  },
  "compiler": {
    "name": "@stylexjs/stylex",
    "version": "0.19.1"
  },
  "capabilities": [
    "static-conflicts",
    "null-clearing"
  ],
  "generation": "8698279cddddcced8546796f962dd6d48dcba7ecb0cd9a087c88a38f15141a88",
  "artifacts": [],
  "styles": {
    "Parity.base": {
      "kind": "compiled",
      "className": "x1e2nbdu xe8ttls x1gslohp x9tbk87",
      "properties": {
        "kMwMTN": "x1e2nbdu",
        "kmVPX3": "xe8ttls",
        "keoZOQ": "x1gslohp",
        "kDPRdz": "x9tbk87"
      }
    },
    "Parity.clear": {
      "kind": "compiled",
      "className": "",
      "properties": {
        "kMwMTN": null
      }
    },
    "Parity.conditional": {
      "kind": "compiled",
      "className": "xju2f9n x1ehdwse xod0847",
      "properties": {
        "kMwMTN": "xju2f9n x1ehdwse xod0847"
      }
    },
    "Parity.shorthand": {
      "kind": "compiled",
      "className": "x1ghz6dp",
      "properties": {
        "kogj98": "x1ghz6dp"
      }
    },
    "site/Parity.stylex.styles.base": {
      "kind": "compiled",
      "className": "x1e2nbdu xe8ttls x1gslohp x9tbk87",
      "properties": {
        "kMwMTN": "x1e2nbdu",
        "kmVPX3": "xe8ttls",
        "keoZOQ": "x1gslohp",
        "kDPRdz": "x9tbk87"
      }
    },
    "site/Parity.stylex.styles.clear": {
      "kind": "compiled",
      "className": "",
      "properties": {
        "kMwMTN": null
      }
    },
    "site/Parity.stylex.styles.conditional": {
      "kind": "compiled",
      "className": "xju2f9n x1ehdwse xod0847",
      "properties": {
        "kMwMTN": "xju2f9n x1ehdwse xod0847"
      }
    },
    "site/Parity.stylex.styles.shorthand": {
      "kind": "compiled",
      "className": "x1ghz6dp",
      "properties": {
        "kogj98": "x1ghz6dp"
      }
    }
  }
}
